address,emails/0,phone,title,website
"803, Pragati Tower, 26, Rajendra Place, New Delhi, Delhi 110008, India",publico.advt@gmail.com,+91 11 4506 1717,PUBLICO ADVERTISING,http://publicoadvertising.com/
"131, Shankar Rd Market, Block E, Rajender Nagar Part 2, New Rajinder Nagar, New Delhi, Delhi, 110060, India",Info@oneclickcommunication.com,+91 98117 78972,One Click Communication,http://oneclickcommunication.com/
"H. No. 1314, Street No. 1, near bada shiv mandir, New Delhi, Delhi 110036, India",,,Qunix Digital - Digital Marketing Agency in Delhi,https://www.kunix.in/
"WZ-572/C, Hall no- 10, Naraina, New Delhi, Delhi 110028, India",,+91 88602 61393,SocioMonkey,http://www.sociomonkey.com/
"3rd Floor, CB-179 A, Ring Rd, Block CB, Naraina Village, Naraina, New Delhi, Delhi 110028, India",contact@sellerbuzz.com,+91 11 4764 0977,SellersBuzz,https://sellersbuzz.com/
"B-710, near Ambey shakti mandir, Budh Nagar, Inder Puri, New Delhi, Delhi 110012, India",80enoch.stoner1980@gmail.com,+91 96671 27627,Re born digital marketing,http://sites.google.com/view/re-born-digital-marketing/home
"2nd Floor, C-127, Block C, Naraina Industrial Area Phase 1, Naraina, Delhi, New Delhi, Delhi 110028, India",info@webkartindia.com,+91 97111 10321,WebKart Digital Pvt. Ltd.,https://webkartindia.com/
"C-130, 2nd Floor, Naraina Industrial Area Phase 1, Naraina, New Delhi, Delhi 110028, India",info@animonlive.com,+91 11 4606 1759,Animon Live digital marketing agency,https://www.animonlive.com/
"CB - 165, First Floor, Ring Rd, Naraina Village, Naraina, Delhi, 110028, India",mail@ohpuhleeez.com,+91 99998 48160,Oh! Puhleeez Advertising & Branding Agency,https://www.digitalmarketinng.com/
"Budh Nagar, Inder Puri, New Delhi, Delhi 110012, India",Info@Digitalmarketingking.in,+91 99100 75663,Digital Marketing King - Best Web Designing & Digital Marketing Agency in Delhi,https://digitalmarketingking.in/
